{
  "version": "1.0.0.0",
  "device_id": {
    "family_id": "0x0115",
    "si_revision_id": "0x22"
  },
  "silicon_id": "0xF181",
  "control_word": {
    "system": {
      "ap": "Enabled"
    },
    "cm33_0": {
      "ap": "Enabled",
      "dbgen": true,
      "niden": true,
      "spiden": true,
      "spniden": true,
      "secure": true
    }
  },
  "die_id": {
    "min": {
      "lot": 0,
      "wafer": 0,
      "xpos": 0,
      "ypos": 0,
      "sort": 0,
      "day": 0,
      "month": 0,
      "year": 0
    },
    "max": {
      "lot": 16777215,
      "wafer": 255,
      "xpos": 255,
      "ypos": 255,
      "sort": 255,
      "day": 255,
      "month": 255,
      "year": 255
    }
  }
}